ids,questions
3417,"Quais são as autoridades competentes para aplicar as sanções de advertência, multas e impedimento de licitar e contratar com órgãos e entidades da Administração do Estado de São Paulo na USP, e quem é responsável pela declaração de inidoneidade para licitar ou contratar com a Administração Pública direta e indireta de todos os entes federativos?"
1797,"Qual é o procedimento para o depósito digital de teses e dissertações pelos alunos de mestrado e doutorado na Universidade de São Paulo?"
12,"Quais são as responsabilidades do Conselho de Reitores das Universidades Estaduais Paulistas conforme estabelecido pelo decreto governamental de 2 de fevereiro de 1989?"
4039,"Quais são os objetivos dos cursos oferecidos pela Faculdade de Filosofia, Letras e Ciências Humanas da USP?"
3650,"Quais critérios a Comissão de Graduação da USP utiliza para avaliar a compatibilidade entre as formações acadêmicas durante o processo de revalidação de diplomas estrangeiros?"
3381,"Quais são as comissões que podem assessorar a Congregação em suas deliberações, conforme estabelecido no regulamento da USP?"
883,"Quais são as condições sob as quais um servidor da Universidade de São Paulo pode ser dispensado do registro de ponto, de acordo com as normas institucionais?"
3830,"Quais são as responsabilidades do Conselho Técnico-Administrativo em relação às aulas na Universidade de São Paulo?"
3186,"Como são organizadas as Comissões Julgadoras dos concursos para provimento de cargos de professor doutor, professor titular e para a obtenção do título de livre-docente na USP?"
1411,"Qual é o prazo máximo para o depósito da dissertação de Mestrado na USP e em que condições pode ser solicitada uma prorrogação desse prazo?"
1250,"Quais são os critérios de avaliação para candidatos ao Doutorado Direto na USP, incluindo os requisitos mínimos relacionados a projetos de iniciação científica, apresentações em congressos e publicações em periódicos?"
794,"Quais departamentos da USP têm a possibilidade de ter a competência de assinar termos de adesão a serviço voluntário e seus eventuais termos aditivos de prorrogação delegada pelo Coordenador de Administração Geral?"
187,"Como é decidido um empate entre examinadores no julgamento de um concurso para Professor Titular na USP?"
3259,"Quais são os critérios de composição e mandato para os membros da Comissão de Inclusão e Pertencimento do Instituto de Química da USP?"
1274,"Quais são os documentos necessários para acompanhar o depósito de uma tese de doutorado na USP?"
4171,"Quais são as competências da Comissão de Inclusão e Pertencimento (CIP) na Universidade de São Paulo?"
21,"Quais são as cadeiras oferecidas pelo Instituto de Educação da USP conforme descrito na seção VI do regulamento?"
3653,"Quais são as instituições que compõem o Quadrilátero Saúde/Direito na Universidade de São Paulo?"
1768,"Como deve ser feito o depósito do exemplar eletrônico de dissertações ou teses na USP e quem deve validar essa submissão?"
1354,"Quais são os requisitos para que um aluno do Mestrado Profissional USP-IDPC possa se inscrever no Exame de Qualificação (EQ)?"
101,"Quais são as principais fontes de receita da Universidade de São Paulo conforme seu regulamento?"
1985,"Quantos membros titulares e suplentes compõem a Comissão Coordenadora de Programa (CCP) do Programa de Pós-Graduação em Ecologia da USP, e qual é a exigência em relação ao coordenador e seu suplente?"
2565,"Qual é o prazo máximo para a entrega das versões corrigidas da Dissertação ou da Tese em formato digital após a defesa na ECA-USP?"
1837,"Quais são os critérios necessários para que o trabalho final nos cursos de Mestrado e Doutorado na USP possa ser apresentado na forma de compilação de artigos?"
4137,"Quais são as responsabilidades da Seção de Livraria Virtual da EDUSP?"
4687,"Quais são os objetivos principais das ações de inclusão e diversidade propostas pela Universidade de São Paulo para sua comunidade acadêmica?"
1092,"Qual é a duração da prova para candidatos a Doutorado em Língua Espanhola ou Estudos da Tradução na USP e em que idioma ela deve ser realizada?"
2355,"Quais são os requisitos para o conteúdo do Relatório de Qualificação exigido para o Exame de Qualificação na USP?"
2752,"Quais são as principais atividades promovidas pelo Instituto de Energia e Ambiente (IEE) da USP para o desenvolvimento de suas funções, conforme estabelecido em seu regimento?"
178,"Quem é responsável pela elaboração dos projetos de extensão de serviços à comunidade na USP e como são aprovados esses projetos?"
1392,"Quais são os requisitos necessários para se inscrever no Doutorado em Saúde Global e Sustentabilidade na USP e quais documentos são exigidos para a inscrição?"
1815,"Quais são os documentos necessários para o depósito digital de uma dissertação ou tese na USP conforme o sistema Janus?"
1814,"Quais são os critérios para o credenciamento específico de orientadores na USP que desejam orientar alunos de iniciação científica nas áreas de Química e Educação?"
2201,"Quais são os requisitos para a apresentação de Dissertações e Teses na USP conforme o Regimento de Pós-Graduação?"
1023,"Quais são as prioridades de alocação de vagas para candidatos do ENEM-USP 2024 na Universidade de São Paulo, e como são realocadas as vagas remanescentes?"
975,"Quais são as condições sob as quais o NACE pode ser desativado na Universidade de São Paulo?"
1433,"Quais são os critérios necessários para o credenciamento de um professor para orientar Doutorados e Doutorado Direto na USP?"
2440,"Quais são os critérios para o credenciamento ou recredenciamento de um orientador na USP?"
4633,"Quem representa a FZEA junto ao Conselho de Pesquisa e Inovação da USP, e o que acontece em caso de vacância dessa posição?"
1707,"Quais são os documentos necessários para a inscrição no processo seletivo de mestrado na USP conforme o regulamento?"
4529,"Quantas vezes o CoPGr e as Câmaras da USP se reúnem ordinariamente durante um semestre letivo, e como são convocadas essas reuniões?"
3496,"Qual é o prazo mínimo de antecedência com que deve ser publicado o edital de convocação para a eleição do Chefe do Departamento e do Vice-Chefe na USP?"
4382,"Quem são os membros obrigatórios do Conselho do Departamento na Universidade de São Paulo conforme o estatuto?"
2825,"Em um processo seletivo da USP, o que acontece se não houver candidatos habilitados com título de Mestre para a segunda etapa de avaliações ou se nenhum dos habilitados atender à convocação para contratação?"
2199,"Quais são os critérios de credenciamento para orientadores plenos em um programa de pós-graduação na USP?"
857,"Quais são as responsabilidades do gestor de contrato conforme definido na Portaria da USP?"
1002,"No Concurso Vestibular FUVEST 2024, o que acontece com um candidato que foi convocado para sua primeira opção de curso e como ele deve proceder em relação à matrícula?"
1433,"Quais são os critérios necessários para o credenciamento de um professor para orientar Doutorados e Doutorado Direto na USP?"
261,"Quais são as consequências para os servidores que não apresentarem a Declaração de Quitação ou comprovante equivalente do pagamento das mensalidades do plano de saúde no contexto do Auxílio-Saúde da USP?"
145,"Quais são as finalidades da Coordenadoria da Saúde e Assistência Social (COSEAS) na Universidade de São Paulo?"
2430,"Qual é a diferença entre o credenciamento pleno e o credenciamento específico de orientadores na USP?"
3391,"Qual é o prazo mínimo e máximo para as inscrições nos concursos de Professor Doutor na USP e quem aprova a abertura dessas inscrições?"
2787,"Quais são as competências das Comissões de Graduação, Pós-Graduação, Pesquisa, Cultura e Extensão Universitária na Universidade de São Paulo?"
953,"Quem constitui o corpo discente da Universidade de São Paulo (USP)?"
4518,"Como um docente pode participar de núcleos de apoio sediados em outra Unidade da USP?"
4687,"Quais são os objetivos principais das ações de inclusão e diversidade propostas pela Universidade de São Paulo?"
4412,"Qual é a duração do mandato dos membros docentes, exceto o presidente e o vice-presidente, nas Comissões de Graduação, Pesquisa e Inovação, de Cultura e Extensão Universitária, e de Inclusão e Pertencimento na USP, e é permitida a recondução?"
65,"Quais são os órgãos que compõem a Reitoria da Universidade de São Paulo e suas respectivas subdivisões conforme descrito nos regulamentos?"
4420,"Quais são as principais atividades técnicas executadas pelo Serviço de Museologia (SM) da Universidade de São Paulo?"
251,"Quais são as etapas do processo seletivo realizado pela Escola Politécnica da USP e quais unidades são responsáveis por cada uma delas?"
3616,"Quais são os programas de Residência Médica oferecidos pela Universidade de São Paulo mencionados na resolução?"
1264,"Quais são as condições sob as quais um aluno pode ser desligado de um programa de pós-graduação na Universidade de São Paulo?"
1927,"Quantos membros titulares e suplentes compõem a Comissão Coordenadora do Programa (CCP) do Programa de Pós-Graduação em História Social da FFLCH, e qual é a duração de seus mandatos?"
67,"Quem substitui o Reitor da USP em seus impedimentos e sucede-o em caso de vaga até novo provimento?"
2719,"Quais são os objetivos institucionais do Museu de Arte Contemporânea (MAC) da Universidade de São Paulo?"
1145,"Quais são os requisitos necessários para a inscrição de um estudante no exame de qualificação de Mestrado na USP, conforme descrito nas normas do programa?"
1945,"Quais são os elementos obrigatórios que devem constar na capa e contracapa de uma dissertação de Mestrado na USP?"
4100,"Quais são os procedimentos necessários para a criação de Centros ou Núcleos dentro de uma Unidade ou Departamento na USP, e quais órgãos devem aprovar seus regimentos?"
4559,"Quais são os critérios para o credenciamento e recredenciamento de orientadores na USP e onde podem ser encontrados?"
894,"Quando um servidor da USP começa a receber o salário-família em relação à esposa e a cada dependente, e quando esse benefício é cessado?"
1479,"Quais são os elementos que devem constar na estrutura de uma dissertação de mestrado na USP, conforme as diretrizes do Sistema Integrado de Bibliotecas (SIBi) USP?"
4288,"Qual mudança ocorreu na função de Procurador Chefe na USP conforme a nova regulamentação?"
4473,"Quais são as modalidades possíveis para a realização de uma prova prática em um concurso na USP, conforme o regulamento?"
181,"Quais são os critérios de julgamento para um concurso de Professor Assistente na USP, conforme estabelecido nas normas?"
1031,"Se um candidato do Processo Seletivo ENEM-USP 2024, inicialmente matriculado na condição [M], não for convocado para remanejamento até a 2ª Chamada, qual será a alteração automática de sua condição de matrícula?"
154,"Quem pode ser designado pelo Diretor para auxiliá-lo no desempenho de suas atribuições na Universidade de São Paulo?"
849,"Qual é o objetivo do princípio da segregação de funções na designação de agentes públicos, conforme estabelecido pela Universidade de São Paulo?" 
1409,"Quais são as modalidades de inscrição oferecidas pelo PPGCOM USP em seus processos seletivos para alunos regulares?"
4583,"Quais são as atribuições do Diretor do ICMC segundo o regimento interno, incluindo as alterações feitas pela Resolução 8503/2023?"
3662,"Quais são os membros que compõem os Conselhos Centrais na Universidade de São Paulo, conforme as normas estabelecidas?"
2777,"Quantas vezes por ano o Conselho Deliberativo da USP deve se reunir ordinariamente, e qual é o intervalo máximo permitido entre essas reuniões?"
2080,"Quais são os critérios para o credenciamento ou recredenciamento de um orientador ou coorientador na USP?"
2923,"Quais são os princípios da gestão acadêmica e administrativa do Museu de Arqueologia e Etnologia (MAE) da USP?"
4586,"Quais são os critérios para a composição da Comissão de Graduação (CG) no ICMC, incluindo a qualificação dos membros docentes e a representação discente?"
3505,"Quais são os critérios avaliados na prova de arguição e no julgamento dos títulos durante o Concurso de Professor Titular na USP?"
4044,"Qual é a duração máxima permitida para a prova de argüição e julgamento do memorial em um concurso de livre-docência na USP, e quanto tempo é concedido ao candidato para responder?"
3313,"Quem pode participar das atividades do RCGI na Universidade de São Paulo e sob quais condições podem ser atribuídas bolsas de estudo aos participantes?"
2776,"Quais são as responsabilidades do órgão deliberativo do Museu Paulista em relação à gestão de pessoal docente e técnico-administrativo?"
897,"Quais são as condições sob as quais um servidor da USP não pode ser concedido licença para tratar de interesses particulares, participar de competições esportivas de amadores, ou para ter exercício em outra Instituição universitária?"
1504,"Qual é o prazo máximo para o credenciamento de um coorientador no curso de doutorado direto na Universidade de São Paulo?"
4016,"Qual é a duração do mandato dos membros titulares e suplentes dos docentes na Comissão de Pós-Graduação da USP e é permitida a recondução?"
988,"Quais são os critérios para um candidato ser elegível às vagas destinadas às Políticas de Ações Afirmativas na USP, especificamente para as categorias Escola Pública (EP) e Pretos, Pardos e Indígenas (PPI)?"
3648,"Quais são os passos necessários para a divulgação dos procedimentos de avaliação de equivalência após sua aprovação pelo Conselho de Graduação na USP?"
3814,"Quem são os membros que compõem o Conselho Técnico-Administrativo da ECA-USP e quais são suas atribuições principais?"
3850,"Qual é a duração do mandato dos membros docentes e de seus suplentes na Comissão de Pós-Graduação da USP e é permitida a recondução para esses cargos?"
4583,"Quais são as atribuições do Diretor do ICMC conforme o regulamento da USP, e como ele pode delegar parte de suas responsabilidades?"
4015,"Quais são as competências do Diretor de uma Unidade na Universidade de São Paulo conforme o regulamento?"
4487,"Quais são as competências do Conselho Técnico-Administrativo (CTA) da USP conforme estabelecido no regulamento?"
905,"Quais são as condições sob as quais um servidor estável da USP pode ser dispensado de suas funções?"
1226,"Quais são os critérios de avaliação para candidatos ao processo seletivo de Mestrado na USP conforme o regulamento?"
1318,"Qual é o número máximo de estudantes de mestrado que um solicitante de credenciamento específico pode orientar na USP e quais são os requisitos para que este possa orientar um doutorando?"
4539,"Quais são as responsabilidades da CPG em relação à participação de professores colaboradores em disciplinas de Pós-Graduação na USP?"
1798,"Em quais idiomas uma dissertação ou tese pode ser redigida e defendida na Universidade de São Paulo?"
2097,"Quais são os critérios de avaliação do desempenho acadêmico e científico dos alunos em um programa de pós-graduação da USP, incluindo as atividades complementares exigidas?"
1764,"Quais são os critérios de credenciamento para coorientadores na pós-graduação da USP, incluindo a possibilidade de credenciamento de profissionais não doutores?"
1932,"Quais são os idiomas aceitos para comprovação de proficiência em língua estrangeira para ingresso no Doutorado na USP, e é possível validar a proficiência apresentada no Mestrado para o Doutorado?"
4384,"Quais são as etapas do concurso para provimento de cargo de Professor Doutor na USP e qual é a consequência para o candidato que obtém nota menor do que 7,0 na prova escrita?"
72,"Quem assume a presidência das Comissões Permanentes da USP na ausência do Reitor e qual é a regra para o voto de desempate nessas situações?"
145,"Qual é a finalidade da Coordenadoria da Saúde e Assistência Social (COSEAS) na Universidade de São Paulo?"
10,"Qual é o quórum necessário para propor a emenda do Estatuto da Universidade de São Paulo segundo a alteração decretada em 1987, e como ele pode ser ajustado nos dois anos subsequentes à vigência dessa alteração?"
4039,"Quais são os objetivos dos cursos da Faculdade de Filosofia, Letras e Ciências Humanas da USP?"
3773,"Como é determinado o tema da prova escrita em um concurso de livre-docência na USP, e qual é o procedimento para a escolha do tema pelo candidato?"
3720,"Quem é responsável pela elaboração dos Regimentos dos campi da Universidade de São Paulo (USP) e qual órgão deve apreciá-los após serem elaborados?"
790,"Quem tem a competência para autorizar despesas de alunos da USP em eventos ou atividades acadêmicas no exterior e qual é o limite de valor estabelecido para essas despesas?"
363,"Qual foi a alteração de regime de trabalho para o cargo de Professor Doutor 1240242 na Universidade de São Paulo, conforme a Portaria GR 7752/2022?"
3445,"Quais são as principais atividades e objetivos do Centro Observatório das Instituições Brasileiras (COI) da Universidade de São Paulo?"
980,"Quais critérios a Comissão de Graduação da USP utiliza para avaliar a compatibilidade das formações acadêmicas no processo de revalidação de diplomas estrangeiros?"
2026,"Qual é o formato final exigido para a entrega eletrônica de dissertações ou teses na USP e onde deve ser realizado o depósito deste arquivo?"
4183,"Qual é o prazo mínimo de divulgação dos editais para seleção de monitores pelos Departamentos na USP?"
4099,"Qual é a duração de uma monitoria na USP e é possível um aluno ser reconduzido a essa função?"
702,"Quando foi revogada a Portaria GR nº 6664/2015, que tratava da criação da Comissão de Planejamento Acadêmico do Campus USP de São Carlos?"
3942,"Quais são as responsabilidades da Comissão de Pesquisa de uma Faculdade na USP?"
3992,"Quais são os critérios para a eleição do Presidente e seu suplente da Comissão de Cultura e Extensão Universitária (CCEx) na USP, e qual é a duração do mandato?"
3519,"Quais são as responsabilidades dos Conselhos dos Departamentos da USP em relação aos laboratórios e serviços do departamento, conforme o regimento?"
4533,"Quem pode ser eleito como representantes discentes na Comissão de Pós-Graduação (CPG) da Universidade de São Paulo (USP) e quais são as condições para sua eleição e recondução?"
2110,"Quais são os critérios para o credenciamento e recredenciamento de disciplinas na USP, incluindo aquelas que são não presenciais ou semipresenciais?"
1190,"Qual é o número máximo de pontos que podem ser atribuídos pela organização de um livro para fins de credenciamento na USP?"
694,"Quais são as responsabilidades do Comitê de Governança relacionadas ao gerenciamento de pesquisas científicas e ações de inovação na USP?"
3347,"Qual órgão anexo foi integrado à Faculdade de Zootecnia e Engenharia de Alimentos da USP segundo a alteração feita pela Resolução 8016/2020?"
3825,"Quando foi oficialmente desmembrada a Faculdade de Odontologia da Faculdade de Farmácia e Odontologia na Universidade de São Paulo?"
1718,"Qual é o prazo máximo para um aluno de Mestrado se inscrever no exame de qualificação na USP e quantos créditos ele deve ter completado para se inscrever?"
166,"Qual é o critério de aprovação de um aluno em uma disciplina na USP em termos de nota final e frequência mínima exigida?"
2349,"Quais são as etapas eliminatórias do processo de seleção para ingresso no Programa de Pós-Graduação em Letras (Teoria Literária e Literatura Comparada) na USP, tanto para Mestrado quanto para Doutorado?"
4138,"Quais são as finalidades da Faculdade de Direito de Ribeirão Preto da Universidade de São Paulo conforme seu regimento?"
1263,"Quais são os procedimentos a serem seguidos por um aluno de pós-graduação da USP caso seu relatório de atividades seja reprovado ou não apresentado dentro do prazo estabelecido?"
2756,"Quais são as responsabilidades do Conselho Diretor (CD) em relação à aprovação de regimentos e modificações no Instituto de Estudos Avançados da USP?"
2836,"Qual é o objetivo principal do Centro de Agricultura Tropical Sustentável (STAC) criado pela Universidade de São Paulo?"
1893,"Como deve ser entregue o relatório de qualificação do estudante à secretaria do PPGTUR?"
2778,"Quais são as etapas do processo de eleição do Diretor e do Vice-Diretor na USP e quem é responsável por conduzi-las?"
4570,"Qual é o prazo máximo para interpor um recurso contra decisões dos órgãos executivos e colegiados da USP, segundo o Regimento Geral da universidade?"
2357,"Qual é o prazo máximo para um aluno de Doutorado Direto sem título de mestre se inscrever para o exame de qualificação na USP?"
4108,"Qual é a composição da Comissão de Graduação na Escola Politécnica da USP e quais são os critérios para a eleição ou designação de seus membros?"
1032,"Quais são os documentos necessários para a pré-matrícula virtual dos candidatos convocados para os cursos de Graduação na USP?"
1837,"Quais são os critérios necessários para que o trabalho final nos cursos de Mestrado e Doutorado na USP possa ser apresentado na forma de compilação de artigos?"
4706,"Quais são as principais responsabilidades do(a) Pró-Reitor(a) Adjunto(a) de Inovação na Universidade de São Paulo?"
3815,"Quem é responsável por designar Comissões temporárias para assessorar em matérias referentes ao funcionamento da Escola de Comunicações e Artes (ECA) da USP?"
3309,"Qual é a finalidade do Centro de Estudos em Inteligência Artificial e Aprendizado de Máquina (CeIAAM) criado pela Universidade de São Paulo?"
4718,"Qual é a composição da Comissão de Inclusão e Pertencimento da USP conforme estabelecido pela Resolução 8455/2023?"
4626,"Quais são as competências da Congregação da Universidade de São Paulo conforme descrito nos regulamentos?"
1081,"Quais são os critérios para a composição da Comissão de Pós-Graduação da Escola de Educação Física e Esporte de Ribeirão Preto (EEFERP) da USP?"
4267,"Quais são as responsabilidades da Comissão de Inclusão e Pertencimento da USP?"
2756,"Quais são as responsabilidades do Conselho Diretor (CD) em relação à aprovação de regimentos e modificações no Instituto de Estudos Avançados da USP?"
1294,"Quantos pontos um docente precisa obter em um período de quatro anos para ser considerado apto ao credenciamento como Orientador Pleno na USP, e qual é a exigência mínima relacionada à produção científica?"
1683,"Qual é o papel do orientador nas Comissões Julgadoras de Dissertações e Teses na USP?"
3396,"Quais são os critérios de ponderação para as diferentes provas e avaliações durante o concurso para provimento de cargos na USP, conforme descrito no regulamento?"
2553,"Quais são as etapas da arguição durante o processo de qualificação de um candidato na pós-graduação da USP e como é organizado o relatório de qualificação segundo o Regimento de Pós-Graduação da USP?"
4153,"Quais são os objetivos principais da Faculdade de Medicina de Ribeirão Preto da Universidade de São Paulo conforme descritos em seu regulamento?"
2914,"Como é feita a divulgação das disciplinas ou atividades de extensão que contarão com alunos monitores na USP, e quais comissões são responsáveis por essa divulgação?"
2624,"Quais são as habilidades que o Programa de Gestão da Inovação (PGI) da USP visa desenvolver nos participantes?"
2045,"Qual é o prazo máximo para o depósito da dissertação de Mestrado na USP?"
4166,"Como são escolhidos o Presidente e o Vice-Presidente da Comissão de Cultura e Extensão Universitária (CCEx) da USP e qual é a duração do mandato deles?"
4505,"Como é constituída a Comissão de Pós-Graduação do IFSC da USP e quais são os critérios para a escolha de seus membros docentes e discentes?"
1961,"Como são avaliados anualmente os estudantes de pós-graduação da USP e quais são os componentes obrigatórios do relatório de atividades?"
3405,"Quais são as responsabilidades do Conselho do Departamento na Universidade de São Paulo?"
4276,"Quais são os critérios para um aluno se tornar monitor em um departamento da Universidade de São Paulo (USP)?"
3904,"Quais são as responsabilidades da Comissão de Pesquisa no Instituto de Biociências da USP?"
1906,"Quantas unidades de crédito um estudante de Mestrado deve integralizar na USP, e como essas unidades são distribuídas entre disciplinas e dissertação?"
3141,"Quais são as principais funções do Comitê Consultivo da USP conforme estabelecido nos regulamentos?"
1245,"Qual é o procedimento para um estudante de pós-graduação da USP que deseja proteger patentes ou direitos autorais relacionados ao seu trabalho de dissertação ou tese?"
4633,"Quem representa a FZEA junto ao Conselho de Pesquisa e Inovação da USP e como ocorre a substituição em caso de ausência?"
2921,"Quais são as principais áreas de atuação do Museu de Arqueologia e Etnologia da USP e como elas se manifestam na instituição?"
2479,"Qual é o prazo máximo para a realização do exame de qualificação após a inscrição para alunos de pós-graduação na USP?"
4233,"Como é constituída a Comissão de Pesquisa e Inovação da USP e qual é o mandato dos seus membros?"
