ids,questions
2872,"Quais são os critérios para um servidor da Universidade de São Paulo obter horário especial de trabalho devido a deficiência própria ou de familiares?"
191,"Quais são as duas categorias de estudantes que compõem o Corpo Discente na USP e quais são os critérios para pertencer a cada uma delas?"
4146,"Quais são as principais atribuições da Comissão de Inclusão e Pertencimento da FDRP conforme estabelecido pela Resolução 8490/2023?"
790,"Quem tem a competência para autorizar despesas de alunos da USP em eventos ou atividades acadêmicas no exterior e qual é o limite de valor para essas despesas?"
2995,"Qual a data de aposentadoria voluntária do Professor Silvio Aparecido de Carvalho na USP e qual lei e resolução estão associadas à criação e extinção do seu cargo?"
1394,"Quais são os critérios utilizados para avaliar a maturidade científica dos candidatos ao Doutorado em Saúde Global e Sustentabilidade na USP?"
4393,"Quais são os instrumentos da gestão acadêmica do Museu de Zoologia da USP segundo o seu regimento?"
1105,"Quais são os critérios para o recredenciamento de orientadores em um programa de pós-graduação na USP?"
4129,"Como são escolhidos o Presidente da Coordenação e seu suplente na Escola Politécnica da USP?"
3197,"Quais são as responsabilidades do Conselho do Departamento na Universidade de São Paulo conforme o regulamento?"
1790,"Quais são os critérios para o credenciamento e recredenciamento de um orientador pleno na área de Pós-Graduação em Oceanografia na USP?"
1816,"Em quais idiomas uma dissertação pode ser redigida e defendida na Universidade de São Paulo, de acordo com o Regimento de Pós-Graduação?"
1194,"Quais idiomas são permitidos para a redação e defesa de Dissertações e Teses na Universidade de São Paulo, além do português?"
4370,"Quais são os departamentos que compõem a Escola de Enfermagem de Ribeirão Preto (EERP) da USP?"
4612,"Quais são os deveres dos discentes de acordo com o Regimento do ICMC da USP?"
2675,"Quais são as responsabilidades de um coordenador de Grupo de Pesquisa na USP conforme o regulamento?"
3808,"Quais são as situações em que a votação será realizada de forma secreta dentro do conselho da USP, conforme as normas estabelecidas?"
4,"Qual é o período mínimo que um candidato ao Mestrado ou Doutoramento deve esperar após a integralização dos créditos exigidos para poder apresentar sua dissertação ou tese na USP?"
2093,"Quais são os critérios de proficiência em língua estrangeira exigidos para candidatos ao programa de Mestrado Profissional na USP?"
887,"Quais são as condições sob as quais o salário de um servidor da USP pode ser objeto de arresto, sequestro ou penhora, conforme o estatuto da universidade?"
1538,"Quais são os critérios obrigatórios para a opção de dissertação em formato de coletânea de artigos na USP?"
932,"Quais são as Comissões Permanentes do Conselho Universitário da USP e como são constituídas essas comissões?"
1904,"Qual é a nota mínima necessária para um candidato ser considerado aprovado em um processo de seleção na USP?"
3409,"Quais são os critérios para que um aluno possa se tornar monitor na FEARP da USP?"
4291,"Quais são as condições para que um aluno de graduação ou pós-graduação possa ser eleito como representante nos termos do Estatuto da USP?"
1584,"Qual é o prazo máximo para a reformulação de um relatório de atividades de pesquisa para alunos de Mestrado na USP?"
2524,"Qual é o número máximo de orientandos que um orientador pode ter na USP e quantos alunos ele pode coorientar adicionalmente?"
3166,"Quem tem direito de voto, mas não de ser votado, nas eleições da representação discente na Universidade de São Paulo?"
1916,"Quais são as consequências para um programa de pós-graduação na USP caso não entregue o relatório anual na data limite ou tenha seu relatório anual reprovado por duas vezes consecutivas?"
3492,"Quem são os membros elegíveis para votar na Comissão de Residência Médica (COREME) da FMUSP?"
4306,"Quantos membros compõem a Comissão de Pós-Graduação (CPG) da USP e como são escolhidos seus integrantes?"
3799,"Como será determinado o início do mandato do primeiro Vice-Diretor eleito em chapas nos Museus e Institutos Especializados da USP, caso os mandatos do Diretor e Vice-Diretor atuais não coincidam?"
4682,"Quem tem acesso às reuniões da Congregação da USP e em quais condições?"
2373,"Quantos créditos são necessários para a integralização do curso de mestrado na USP e como eles são distribuídos entre disciplinas e dissertação?"
882,"Quantas vezes por mês um servidor da USP pode se retirar temporária ou definitivamente durante o expediente sem desconto em seu salário, e sob que condição essa autorização é concedida?"
2938,"Qual é a porcentagem de representação discente nas Comissões da USP e como é eleita essa representação?"
2701,"A participação em projetos de pesquisa apoiados pelo CEBIMar gera vínculo empregatício ou funcional entre a Universidade de São Paulo e os membros desses projetos?"
4306,"Quantos membros compõem a Comissão de Pós-Graduação (CPG) da USP e como são escolhidos seus integrantes?"
3657,"Qual é o mandato dos representantes das Classes Trabalhadoras do Estado de São Paulo no contexto mencionado?"
3688,"Quais são as etapas do concurso público para a obtenção do título de Livre-Docente na Universidade de São Paulo (USP)?"
107,"Como é escolhido o Reitor da Universidade de São Paulo e qual é a duração do seu mandato?"
4515,"Quais são os meses em que as inscrições para o Concurso de Livre-Docência na USP estão abertas, e quais idiomas são aceitos para a redação do memorial e da tese original ou do texto exigidos na inscrição?"
2681,"Qual é a principal função do Centro de Informática de São Carlos (CISC) na Universidade de São Paulo?"
4229,"Qual é a carga horária mínima semanal em disciplinas obrigatórias para a matrícula na graduação na USP, e quais são as exceções a essa regra?"
20,"Quais são as áreas de estudo abrangidas pela secção de letras na regulamentação da Faculdade, conforme o artigo 21?"
4454,"Quais são as competências da Comissão de Pós-Graduação (CPG) na Universidade de São Paulo?"
4664,"Quais são as principais responsabilidades das Comissões de Graduação, Pós-Graduação, Pesquisa e Cultura e Extensão Universitária na Universidade de São Paulo?"
4265,"Qual é a composição e os mandatos dos membros da Comissão de Inclusão e Pertencimento da FMVZ-USP?"
2218,"Quais são os documentos necessários para um aluno solicitar a mudança de curso de Mestrado para Doutorado Direto na USP?"
3179,"Quem é responsável pela convocação de sessões ordinárias ou extraordinárias na USP e com quanto tempo de antecedência deve ser feita essa convocação?"
127,"Qual é o prazo máximo assegurado para um candidato inscrito a concurso de doutoramento, até a data da vigência do Estatuto da USP, concluir seu doutorado?"
3918,"Quais são os períodos de inscrição para monitoria na Universidade de São Paulo conforme a última atualização normativa?"
2069,"Qual é o prazo máximo para o depósito da tese de Doutorado na USP, tanto para portadores do título de mestre quanto para aqueles que ingressam diretamente no Doutorado, e é possível solicitar prorrogação desse prazo?"
4328,"Quais são as quatro provas que compõem o concurso de Livre-Docência na Universidade de São Paulo e quais são seus respectivos pesos?"
2933,"Quais são as fases e provas, incluindo seus respectivos pesos, que compõem o concurso para Professor Doutor na USP?"
4289,"Quais são os objetivos do Regimento da Escola de Artes, Ciências e Humanidades (EACH) da Universidade de São Paulo?"
4397,"Como são propostos os cargos docentes na Universidade de São Paulo e quais são os requisitos para essa proposição?"
3255,"Quais são os critérios para a composição da Comissão de Inclusão e Pertencimento do IP na USP, incluindo a duração do mandato e a possibilidade de recondução para seus membros?"
4283,"Quais são as responsabilidades dos Procuradores da Universidade de São Paulo que estão lotados nos campi do interior?"
3206,"Qual é a duração mínima e máxima permitida para a prova de erudição segundo as normas da USP?"
2871,"Qual é o requisito atualizado para a expedição de segunda via de diplomas pela Universidade de São Paulo em caso de extravio?"
4015,"Quais são as competências do Diretor de uma Unidade na Universidade de São Paulo conforme o regulamento?"
2697,"Quais são os critérios para a composição da Comissão Científica do CEBIMar segundo o seu regimento?"
3915,"Qual é a duração máxima permitida para as provas públicas de arguição nos concursos de Professor Doutor, Livre-Docência e Professor Titular na USP, e sob que condições o diálogo entre examinador e examinado é permitido?"
4497,"Qual é a função do GACInt na promoção de assuntos referentes a relações internacionais na USP?"
3872,"Qual é a duração do mandato dos docentes eleitos pela Congregação para fazer parte da Comissão de Pesquisa na USP e é permitida a recondução?"
4427,"Quem pode participar das reuniões do CTA da ESALQ sem direito a voto?"
2045,"Qual é o prazo máximo para o depósito da dissertação de Mestrado na USP?"
4218,"Quem tem a autoridade para veicular notícias e informações ou divulgar o nome e imagens do HRAC?"
937,"Quais são as principais responsabilidades do Reitor da Universidade de São Paulo conforme o regulamento institucional?"
4738,"Quais são os critérios de avaliação e seus respectivos pesos para o concurso de Professor Doutor na USP quando realizado em uma única fase?"
165,"Quais são os objetivos do primeiro ciclo dos currículos de graduação na USP, conforme estabelecido nos regulamentos da universidade?"
901,"Qual é o procedimento para um servidor da USP reassumir o exercício após desistir de uma licença e qual a condição para gozar da parte restante da licença?"
1054,"Quantos candidatos por vaga são convocados para a seleção na primeira etapa do processo de transferência para a maioria dos cursos na USP, e qual é a exceção mencionada?"
3332,"Quais são as principais funções da Comissão de Inclusão e Pertencimento da Faculdade de Odontologia de Bauru conforme estabelecido pela USP?"
852,"Quem é designado como pregoeiro nas licitações na modalidade pregão na USP e quais são suas principais atribuições?"
960,"Quando acontecerá anualmente o Festival de Arte e Cultura na Universidade de São Paulo (USP) e quem será responsável pela sua coordenação?"
106,"Quem é responsável por decidir sobre a distinção entre disciplinas distintas na USP, baseando-se em propostas dos Departamentos?"
2756,"Quais são as responsabilidades do Conselho Diretor (CD) em relação à aprovação de regimentos e modificações no Instituto de Estudos Avançados da USP?"
109,"Quais são as responsabilidades do Reitor da Universidade de São Paulo conforme o estatuto da instituição?"
3648,"Quais são os passos necessários para a divulgação dos procedimentos de avaliação de equivalência após sua aprovação pelo Conselho de Graduação na USP?"
3304,"Qual é o objetivo do Programa USP de Incentivo a Centros de Pesquisa e Inovação Especiais (CEPIx) criado pela Universidade de São Paulo?"
4425,"Quais são os critérios para a composição da representação docente na Congregação da ESALQ segundo o regulamento da USP?"
4282,"Quais são as principais responsabilidades dos Procuradores Chefes na Universidade de São Paulo conforme a normativa vigente?"
1970,"Quantos créditos são exigidos para a conclusão do curso de doutorado direto na USP, e como eles se distribuem entre disciplinas e preparo da tese?"
1744,"Quais são os critérios para o credenciamento ou recredenciamento de um orientador na USP, seja da academia ou da empresa?"
3142,"Quais são as responsabilidades do Coordenador relacionadas à promoção de atividades e interações dentro e fora da Universidade de São Paulo, conforme descrito em um regulamento da USP?"
2766,"Quais são as responsabilidades da Comissão de Relações Internacionais (CRint) na Universidade de São Paulo?"
2560,"Quais são os critérios adicionais considerados para o recredenciamento pleno de docentes no Programa de pós-graduação em Meios e Processos Audiovisuais na USP?"
3758,"Como são definidos os programas dos concursos para professores na Universidade de São Paulo, e qual órgão é responsável por sua aprovação?"
2151,"Quais são os critérios necessários para o credenciamento de um orientador externo em um programa de pós-graduação na USP?"
2054,"Quais são os critérios mínimos para o credenciamento pleno de um orientador de mestrado no Programa de Pós-graduação em Design na USP?"
1544,"Quais são os critérios utilizados na avaliação do projeto de pesquisa e do currículo na primeira etapa do processo de seleção para o doutorado na área de Educação na USP?"
3779,"Os professores visitantes e colaboradores podem votar ou ser votados nos Colegiados da Universidade de São Paulo?"
2531,"Quais são os requisitos para a submissão de dissertações ou teses na Universidade de São Paulo?"
4561,"Qual é o requisito mínimo de formação para um coorientador de Pós-Graduação na USP, e em que condições excepcionais pode-se aprovar um coorientador sem esse requisito?"
4678,"Quais são as finalidades da Faculdade de Direito segundo o seu regulamento?"
2016,"Quais são os exames de proficiência em língua inglesa aceitos para matrícula nos programas de mestrado e doutorado na USP e quais os níveis mínimos exigidos pelo CEFR para cada um desses programas?"
935,"Quais são as principais responsabilidades do Conselho de Cultura e Extensão Universitária da USP?"
4637,"Quais são os critérios de composição e mandato para os membros da Comissão de Relações Internacionais (CRInt) da Faculdade de Zootecnia e Engenharia de Alimentos (FZEA) da USP?"
4003,"Qual é a nota mínima que um candidato deve obter na prova escrita para não ser eliminado em um concurso de duas fases na USP?"
2719,"Quais são os objetivos institucionais do Museu de Arte Contemporânea (MAC) da Universidade de São Paulo?"
4213,"Qual é o mandato do presidente e do suplente eleitos pela Comissão de Pós-Graduação (CPG) da USP de Bauru, e é permitida a recondução para esses cargos?"
4124,"Como é feita a admissão de Auxiliares de Ensino e Assistentes na Escola Politécnica da USP e quais são os critérios para sua seleção?"
1205,"Quantos créditos em disciplinas um aluno de Mestrado precisa completar para obter o título na USP e qual a porcentagem desses créditos que deve ser realizada dentro do Programa de Pós-Graduação em Entomologia?"
2758,"Quais são os critérios para a composição da Comissão Eleitoral responsável pelo processo eleitoral de dirigentes em um instituto da USP, conforme o regulamento?"
1502,"Quais são os critérios necessários para o credenciamento pleno de um docente como orientador no programa de pós-graduação, segundo as normas da USP?"
1577,"Qual é o prazo máximo para candidatos aos Cursos de Mestrado na USP demonstrarem proficiência em Língua Inglesa após a matrícula?"
2151,"Quais são os critérios necessários para o credenciamento de um orientador externo em um programa de pós-graduação na USP?"
1994,"Qual é o prazo máximo para um aluno de Mestrado se inscrever no processo seletivo de ingresso para Doutorado Direto, caso deseje mudar de curso na USP?"
4545,"Quais são os critérios para a concessão de prorrogação de prazo para depósito da Dissertação ou Tese na USP?"
3873,"Qual é a composição da Comissão de Pesquisa da Universidade de São Paulo  e qual é o mandato dos seus membros?"
3924,"Quais são as atividades de responsabilidade exclusiva do docente que um aluno monitor está terminantemente proibido de realizar na USP?"
4564,"Quais são os critérios para a composição da comissão julgadora de dissertações e teses na USP, incluindo as exceções e restrições?"
4233,"Quais são os critérios para a composição da Comissão de Pesquisa e Inovação na USP?"
1908,"Quais são os critérios de proficiência em língua inglesa exigidos para alunos de mestrado na USP, incluindo as pontuações mínimas nos testes TOEFL, IELTS, CAMBRIDGE, TOEIC e MICHIGAN?"
4652,"Qual é a duração do mandato dos representantes docentes na Comissão de Cultura e Extensão Universitária (CCEx) da USP e é permitida a recondução?"
2708,"Qual é a frequência das reuniões ordinárias do Conselho Deliberativo (CD) e como são convocadas as reuniões extraordinárias e ordinárias?"
2186,"Qual é a nota mínima que os candidatos devem obter em ambas as fases do processo seletivo para serem aceitos no Programa de Mestrado ou Doutorado na USP?"
359,"Quais são as causas que podem levar à cessação de uma bolsa de pós-doutorado na Universidade de São Paulo conforme a Portaria mencionada?"
2286,"Qual é a língua estrangeira obrigatória para os pós-graduandos de um determinado programa na USP e quais são os critérios para comprovar a proficiência nesta língua?"
235,"Quais são as consequências para os alunos que não confirmarem ou não comparecerem às entrevistas da segunda fase do processo seletivo na Escola Politécnica da USP?"
924,"Como é determinada a correspondência entre os cargos e funções dos servidores optantes e as modalidades e classes de funções autárquicas na USP?"
3678,"Quais são as responsabilidades atribuídas aos Departamentos da Universidade de São Paulo conforme o regulamento institucional?"
3714,"Quais são as competências atribuídas à Superintendência de Tecnologia da Informação (STI) da Universidade de São Paulo?"
946,"Quais são os requisitos mínimos para admissão aos cursos de graduação na Universidade de São Paulo (USP)?"
4655,"Como são estabelecidos os concursos para provimento de cargos e acesso à função da carreira na USP, e quais documentos regulamentam esses processos?"
1904,"Qual é a nota mínima necessária para um candidato ser considerado aprovado em um processo de seleção na USP?"
2810,"Quais são os principais objetivos da Pró-Reitoria de Inclusão e Pertencimento (PRIP) na Universidade de São Paulo?"
956,"Qual é o prazo estabelecido para os Conselhos Centrais da USP elaborarem e submeterem seus Regimentos ao Conselho Universitário, e quais normas devem ser fixadas em seus Regimentos?"
3593,"Quem tem a responsabilidade de convocar ordinariamente as reuniões do Conselho Gestor na USP e sob quais condições membros do Conselho podem solicitar a convocação de uma reunião?"
4181,"Como é determinado o programa do concurso para inscrição em disciplinas na USP e quem é responsável por sua aprovação?"
5,"Qual decreto removeu dispositivos do Estatuto e do Regimento Geral da Universidade de São Paulo relacionados à possibilidade de matrícula em mais de um curso e em que data foi publicado?" 
1191,"Qual é o prazo estabelecido para o credenciamento de coorientadores no curso de mestrado na USP?"
1056,"O que acontece se um candidato desrespeitar as normas do Exame de Transferência Externa USP 2024/2025 ou não seguir as instruções do Manual da Transferência 2024/2025?"
1921,"Qual é o número máximo de estudantes de pós-graduação que um solicitante de credenciamento específico pode orientar simultaneamente na USP?"
1740,"Quais são as formas aceitas para comprovar proficiência em língua inglesa para inscrição em processo seletivo na USP, e existe alguma condição especial para estrangeiros cuja língua nativa é o inglês?"
4752,"Qual é o prazo para a inscrição prévia de candidaturas à Presidência e à Vice-Presidência da Comissão de Pesquisa e Inovação da USP, e o que acontece se não houver ao menos duas inscrições dentro desse prazo?"
3314,"Quem são os responsáveis por fazer propostas ao Comitê Gestor do RCGI e implementar suas decisões na Universidade de São Paulo?"
1435,"Quais são os critérios mínimos exigidos para o credenciamento específico de orientadores de mestrado na USP?"
923,"Como é formada a Comissão Permanente responsável por opinar sobre modificações no Estatuto da Universidade de São Paulo e quem tem a autoridade para designar seus membros?"
3338,"Quais são as responsabilidades da CoC em relação ao projeto político pedagógico de um curso na USP, conforme as normas recentemente atualizadas?"
4535,"Quem é responsável por homologar e divulgar a relação dos candidatos selecionados para ingresso na Pós-Graduação na USP?"
1264,"Quais são as condições sob as quais um aluno pode ser desligado de um programa de pós-graduação na Universidade de São Paulo?"
4696,"Quantos dias de prazo são dados para as inscrições do concurso à livre-docência na USP?"
4024,"Quais são os critérios para a admissão de Auxiliares de Ensino e Assistentes na Universidade de São Paulo?"
4668,"Quais são os critérios para a eleição do presidente e vice-presidente da Comissão de Pesquisa e Inovação (CPqI) da USP, e como é determinado o número de representantes docentes de cada departamento nesta comissão?"
133,"Quais são as responsabilidades do Diretor Presidente da EDUSP em relação às atividades editoriais e livreiras na Universidade de São Paulo?"
4608,"Quais são os critérios para o recrutamento de alunos monitores na USP, conforme as normas mais recentes?"
4605,"Quais são os pesos atribuídos às provas no concurso para professor titular na Universidade de São Paulo conforme a última regulamentação?"
3994,"Quem são os membros do Conselho do Departamento na USP e como são escolhidos?"
3645,"Quais são os critérios para a revalidação de diplomas de graduação expedidos por instituições de ensino superior estrangeiras pela Universidade de São Paulo?"
3883,"Quais são as etapas do concurso para o cargo de Professor Doutor na USP e quais são os pesos atribuídos a cada uma delas?"
367,"Quais são os critérios para a seleção de bolsistas para o programa de pós-doutorado na Faculdade de Direito da USP?"
2188,"Quantas unidades de crédito um estudante de Mestrado deve integralizar para a elaboração da dissertação na USP e quantas para disciplinas?"
1592,"Quais são os documentos necessários que devem ser inseridos no Sistema Janus de depósito digital para o depósito do exemplar da Dissertação ou Tese na USP?"
3837,"Qual é o mandato dos membros da representação discente no Conselho de um Departamento da Universidade de São Paulo e é possível a recondução para novos mandatos?"
4099,"Qual é a duração de uma monitoria na Universidade de São Paulo e quantas vezes um aluno pode ser reconduzido a essa função por semestre?"
1206,"Quantos créditos especiais um aluno da Universidade de São Paulo pode receber por participar do Programa de Aperfeiçoamento do Ensino (PAE)?"
2062,"Quantos exemplares em formato PDF de uma dissertação de Mestrado devem ser depositados na USP, e em que circunstâncias são necessários exemplares impressos adicionais?"
3305,"Quais são os critérios para que os CEPIDs da FAPESP sediados na USP sejam elegíveis para os benefícios previstos na resolução mencionada?"
3707,"Quais são os requisitos necessários para uma entidade se associar à Universidade de São Paulo (USP) e como é feita a avaliação dessa associação?"
2112,"Qual é a duração máxima permitida para a exposição oral de um aluno sobre seu projeto de pesquisa durante o processo de avaliação na USP?"
2814,"Quantas vezes por ano o Conselho de Inclusão e Pertencimento (CoIP) da USP realiza reuniões ordinárias e sob quais condições são convocadas reuniões extraordinárias?"
229,"Como são criados e providos os cargos na Universidade de São Paulo e nos Institutos que dela fazem parte?"
2388,"Quais são os critérios para a produção intelectual exigidos para o credenciamento de orientadores no Programa, e como é avaliada a qualidade dessa produção?"
4338,"Quais são as responsabilidades do CoCEx em relação às atividades de cultura e extensão universitária na USP?"
2341,"Quantas vezes por ano o comitê deve se reunir com o candidato durante sua permanência no Programa de Pós-Graduação (PPG) da USP e qual é a obrigatoriedade relacionada à primeira reunião?"
2411,"Qual é o número mínimo e máximo de alunos que um docente deve orientar como orientador específico do Programa de Pós-Graduação da USP, conforme as normas de credenciamento?"
2924,"Quais são as funções e atividades de natureza museológica que devem ser organicamente incluídas no corpo técnico de um museu, segundo a normativa da USP?"
2214,"Quais são os critérios avaliados no Exame de Qualificação de pós-graduação na USP?"
4598,"Quais são as principais responsabilidades da Comissão da Biblioteca no Instituto de Ciências Matemáticas e de Computação (ICMC) da USP?"
502,"Quais são os grupos de trabalho que compõem a Comissão mencionada na norma da USP e qual é a estrutura de coordenação desses grupos?"
4352,"Qual é a porcentagem da representação discente em relação à representação docente nas Comissões de Coordenação de Curso (CoC) e na Comissão de Pós-Graduação (CPG) da Faculdade de Odontologia de Bauru da USP, e qual é a duração do mandato dos representantes discentes nessas comissões?"
